{
  "accept": "application/json",
  "x-stainless-retry-count": "0",
  "x-stainless-timeout": "600",
  "x-stainless-lang": "js",
  "x-stainless-package-version": "0.70.0",
  "x-stainless-os": "Linux",
  "x-stainless-arch": "x64",
  "x-stainless-runtime": "node",
  "x-stainless-runtime-version": "v24.11.1",
  "anthropic-dangerous-direct-browser-access": "true",
  "anthropic-version": "2023-06-01",
  "x-app": "cli",
  "user-agent": "claude-cli/2.0.76 (external, cli)",
  "authorization": "Bearer ***REDACTED***",
  "content-type": "application/json",
  "anthropic-beta": "claude-code-20250219,interleaved-thinking-2025-05-14,context-man....",
  "x-stainless-helper-method": "stream",
  "accept-language": "*",
  "sec-fetch-mode": "cors",
  "accept-encoding": "identity"
}